{
  "_schema_version": "1.0",
  "_evidence_date": "2026-09-04",
  "_generated_at_utc": "2026-09-03T23:11:56Z",
  "_generator": "scripts/snapshot_sources.py",
  "evidence": [
    {
      "evidence_id": "ev-20260904-92368",
      "source_url": "https://www.cisa.gov/sites/default/files/feeds/known_exploited_vulnerabilities.json",
      "source_type": "cisa_kev",
      "published_at_utc": "2026-09-02T16:54:39.8321Z",
      "retrieved_at_utc": "2026-09-03T23:11:48Z",
      "content_sha256": "92368755147fb3d90be91ed41cee0f1ae15f26e3d9dd8b10d37b38b9ed38726d",
      "http_etag": "\"19dd0c-65a82e4210ee0\"",
      "http_last_modified": "Wed, 02 Sep 2026 16:54:39 GMT",
      "snapshot_path": "forecaster/evidence/snapshots/kev/2026/09/92368755147fb3d90be91ed41cee0f1ae15f26e3d9dd8b10d37b38b9ed38726d.json.gz",
      "extract": {
        "catalog_version": "2026.09.02",
        "date_released": "2026-09-02T16:54:39.8321Z",
        "count": 1694,
        "max_date_added": "2026-09-02",
        "_full_catalog_note": "全件の cveID→dateAdded は snapshot_path のスナップショットに入っている。load_kev_snapshot() で読むこと（manifest へは重複保存しない）。"
      },
      "parser_version": "kev-extract-v1"
    },
    {
      "evidence_id": "ev-20260904-f6acf",
      "source_url": "https://www.jpcert.or.jp/rss/jpcert.rdf",
      "source_type": "cert",
      "retrieved_at_utc": "2026-09-03T23:11:49Z",
      "content_sha256": "f6acff7027996930c3da7a1841a4b872fcea11fb092aa1795c34c72dfa372f22",
      "http_etag": "\"35a7-65a9066a2ce00\"",
      "http_last_modified": "Thu, 03 Sep 2026 09:01:44 GMT",
      "snapshot_path": "forecaster/evidence/snapshots/feed/2026/09/f6acff7027996930c3da7a1841a4b872fcea11fb092aa1795c34c72dfa372f22.xml.gz",
      "extract": {
        "feed_name": "JPCERT/CC",
        "confirmation_channel": "cert",
        "content_length": 13735,
        "_note": "本文は解釈せず生バイトで保存している。意味づけは正規化が行う。"
      },
      "parser_version": "channel-feed-v1"
    },
    {
      "evidence_id": "ev-20260904-2308d",
      "source_url": "https://blogs.jpcert.or.jp/ja/atom.xml",
      "source_type": "cert",
      "retrieved_at_utc": "2026-09-03T23:11:50Z",
      "content_sha256": "2308d5aec51edca3c5298fd2742f96ce8348ced0609929917b34b9b6635cbfb2",
      "http_etag": null,
      "http_last_modified": null,
      "snapshot_path": "forecaster/evidence/snapshots/feed/2026/09/2308d5aec51edca3c5298fd2742f96ce8348ced0609929917b34b9b6635cbfb2.xml.gz",
      "extract": {
        "feed_name": "JPCERT/CC Eyes",
        "confirmation_channel": "cert",
        "content_length": 283466,
        "_note": "本文は解釈せず生バイトで保存している。意味づけは正規化が行う。"
      },
      "parser_version": "channel-feed-v1"
    },
    {
      "evidence_id": "ev-20260904-0e26d",
      "source_url": "https://jvn.jp/rss/jvn.rdf",
      "source_type": "cert",
      "retrieved_at_utc": "2026-09-03T23:11:50Z",
      "content_sha256": "0e26de4a8927590193632571b55c5b0f40348ca8d9f11587601970178d7b63b8",
      "http_etag": "\"67ecea1f3d17bdf907ccdbf2fe754e592af6ef16\"",
      "http_last_modified": "Thu, 03 Sep 2026 06:00:10 GMT",
      "snapshot_path": "forecaster/evidence/snapshots/feed/2026/09/0e26de4a8927590193632571b55c5b0f40348ca8d9f11587601970178d7b63b8.xml.gz",
      "extract": {
        "feed_name": "JVN",
        "confirmation_channel": "cert",
        "content_length": 16618,
        "_note": "本文は解釈せず生バイトで保存している。意味づけは正規化が行う。"
      },
      "parser_version": "channel-feed-v1"
    },
    {
      "evidence_id": "ev-20260904-d3d24",
      "source_url": "https://jvndb.jvn.jp/ja/rss/jvndb_new.rdf",
      "source_type": "cert",
      "retrieved_at_utc": "2026-09-03T23:11:53Z",
      "content_sha256": "d3d2495647c1b5d5dc9cfaced350beb7346c12684da0a2497015122030c4f49d",
      "http_etag": "\"fda16-65a8f8bc48800\"",
      "http_last_modified": "Thu, 03 Sep 2026 08:00:32 GMT",
      "snapshot_path": "forecaster/evidence/snapshots/feed/2026/09/d3d2495647c1b5d5dc9cfaced350beb7346c12684da0a2497015122030c4f49d.xml.gz",
      "extract": {
        "feed_name": "JVN iPedia 新着",
        "confirmation_channel": "cert",
        "content_length": 1038870,
        "_note": "本文は解釈せず生バイトで保存している。意味づけは正規化が行う。"
      },
      "parser_version": "channel-feed-v1"
    },
    {
      "evidence_id": "ev-20260904-e1398",
      "source_url": "https://www.ipa.go.jp/security/rss/alert.rdf",
      "source_type": "cert",
      "retrieved_at_utc": "2026-09-03T23:11:54Z",
      "content_sha256": "e1398ecc0b6c007fb2ac23cca8c167ef7e9dedfaa31e5f6a44c324d0eb5ef860",
      "http_etag": null,
      "http_last_modified": "Tue, 18 Aug 2026 07:19:45 GMT",
      "snapshot_path": "forecaster/evidence/snapshots/feed/2026/08/e1398ecc0b6c007fb2ac23cca8c167ef7e9dedfaa31e5f6a44c324d0eb5ef860.xml.gz",
      "extract": {
        "feed_name": "IPA 重要なセキュリティ情報",
        "confirmation_channel": "cert",
        "content_length": 127108,
        "_note": "本文は解釈せず生バイトで保存している。意味づけは正規化が行う。"
      },
      "parser_version": "channel-feed-v1"
    },
    {
      "evidence_id": "ev-20260904-58475",
      "source_url": "https://unit42.paloaltonetworks.com/feed/",
      "source_type": "vendor",
      "retrieved_at_utc": "2026-09-03T23:11:54Z",
      "content_sha256": "584756914c87b4c9f78de38516f847699842fac58fb9e4f679603cfd14eb446a",
      "http_etag": "\"d8af79fc8fcdc9f42e4fb4ea9aad44d1-gzip\"",
      "http_last_modified": "Thu, 03 Sep 2026 17:23:31 GMT",
      "snapshot_path": "forecaster/evidence/snapshots/feed/2026/09/584756914c87b4c9f78de38516f847699842fac58fb9e4f679603cfd14eb446a.xml.gz",
      "extract": {
        "feed_name": "Unit 42",
        "confirmation_channel": "vendor",
        "content_length": 24839,
        "_note": "本文は解釈せず生バイトで保存している。意味づけは正規化が行う。"
      },
      "parser_version": "channel-feed-v1"
    },
    {
      "evidence_id": "ev-20260904-e46a4",
      "source_url": "https://labs.watchtowr.com/rss/",
      "source_type": "vendor",
      "retrieved_at_utc": "2026-09-03T23:11:54Z",
      "content_sha256": "e46a4f3317f53eda7c22e9628a3cfdb9198ce2168b056d8ccb021cb4d0053876",
      "http_etag": null,
      "http_last_modified": null,
      "snapshot_path": "forecaster/evidence/snapshots/feed/2026/09/e46a4f3317f53eda7c22e9628a3cfdb9198ce2168b056d8ccb021cb4d0053876.xml.gz",
      "extract": {
        "feed_name": "watchTowr Labs",
        "confirmation_channel": "vendor",
        "content_length": 586472,
        "_note": "本文は解釈せず生バイトで保存している。意味づけは正規化が行う。"
      },
      "parser_version": "channel-feed-v1"
    },
    {
      "evidence_id": "ev-20260904-21bb4",
      "source_url": "https://cloudblog.withgoogle.com/topics/threat-intelligence/rss/",
      "source_type": "vendor",
      "retrieved_at_utc": "2026-09-03T23:11:56Z",
      "content_sha256": "21bb463d6b4b508c65f2bd3f672aaf18f9d3ba42088b86d94f92d01a06c0816d",
      "http_etag": null,
      "http_last_modified": null,
      "snapshot_path": "forecaster/evidence/snapshots/feed/2026/09/21bb463d6b4b508c65f2bd3f672aaf18f9d3ba42088b86d94f92d01a06c0816d.xml.gz",
      "extract": {
        "feed_name": "Google Threat Intelligence (Mandiant)",
        "confirmation_channel": "vendor",
        "content_length": 1226497,
        "_note": "本文は解釈せず生バイトで保存している。意味づけは正規化が行う。"
      },
      "parser_version": "channel-feed-v1"
    },
    {
      "evidence_id": "ev-20260904-364b0",
      "source_url": "https://isc.sans.edu/rssfeed.xml",
      "source_type": "telemetry",
      "retrieved_at_utc": "2026-09-03T23:11:56Z",
      "content_sha256": "364b0a8bb0038d1fa46ecc5070e8b41c73947f3457bc8a01c98e1819e80955ec",
      "http_etag": "\"1c49-65a9c3cbbbd40\"",
      "http_last_modified": "Thu, 03 Sep 2026 23:09:00 GMT",
      "snapshot_path": "forecaster/evidence/snapshots/feed/2026/09/364b0a8bb0038d1fa46ecc5070e8b41c73947f3457bc8a01c98e1819e80955ec.xml.gz",
      "extract": {
        "feed_name": "SANS Internet Storm Center",
        "confirmation_channel": "telemetry_provider",
        "content_length": 7241,
        "_note": "本文は解釈せず生バイトで保存している。意味づけは正規化が行う。"
      },
      "parser_version": "channel-feed-v1"
    }
  ]
}
