{
  "_schema_version": "1.0",
  "_evidence_date": "2026-09-12",
  "_generated_at_utc": "2026-09-11T23:10:20Z",
  "_generator": "scripts/snapshot_sources.py",
  "evidence": [
    {
      "evidence_id": "ev-20260912-c2767",
      "source_url": "https://www.cisa.gov/sites/default/files/feeds/known_exploited_vulnerabilities.json",
      "source_type": "cisa_kev",
      "published_at_utc": "2026-09-11T19:32:16.8993Z",
      "retrieved_at_utc": "2026-09-11T23:10:10Z",
      "content_sha256": "c27673ad6c346c50f573c566f14c11c373e4ae452880d2cdb8f01a364e1e630b",
      "http_etag": "\"1a4321-65b3a2462cef0\"",
      "http_last_modified": "Fri, 11 Sep 2026 19:32:16 GMT",
      "snapshot_path": "forecaster/evidence/snapshots/kev/2026/09/c27673ad6c346c50f573c566f14c11c373e4ae452880d2cdb8f01a364e1e630b.json.gz",
      "extract": {
        "catalog_version": "2026.09.11",
        "date_released": "2026-09-11T19:32:16.8993Z",
        "count": 1709,
        "max_date_added": "2026-09-11",
        "_full_catalog_note": "全件の cveID→dateAdded は snapshot_path のスナップショットに入っている。load_kev_snapshot() で読むこと（manifest へは重複保存しない）。"
      },
      "parser_version": "kev-extract-v1"
    },
    {
      "evidence_id": "ev-20260912-ade0a",
      "source_url": "https://www.jpcert.or.jp/rss/jpcert.rdf",
      "source_type": "cert",
      "retrieved_at_utc": "2026-09-11T23:10:10Z",
      "content_sha256": "ade0af3216bf38c8c2d258012d483639af405df158646e8cf663ec0d18e4fb21",
      "http_etag": "\"3451-65b2d554c8cc0\"",
      "http_last_modified": "Fri, 11 Sep 2026 04:15:23 GMT",
      "snapshot_path": "forecaster/evidence/snapshots/feed/2026/09/ade0af3216bf38c8c2d258012d483639af405df158646e8cf663ec0d18e4fb21.xml.gz",
      "extract": {
        "feed_name": "JPCERT/CC",
        "confirmation_channel": "cert",
        "content_length": 13393,
        "_note": "本文は解釈せず生バイトで保存している。意味づけは正規化が行う。"
      },
      "parser_version": "channel-feed-v1"
    },
    {
      "evidence_id": "ev-20260912-2308d",
      "source_url": "https://blogs.jpcert.or.jp/ja/atom.xml",
      "source_type": "cert",
      "retrieved_at_utc": "2026-09-11T23:10:11Z",
      "content_sha256": "2308d5aec51edca3c5298fd2742f96ce8348ced0609929917b34b9b6635cbfb2",
      "http_etag": null,
      "http_last_modified": null,
      "snapshot_path": "forecaster/evidence/snapshots/feed/2026/09/2308d5aec51edca3c5298fd2742f96ce8348ced0609929917b34b9b6635cbfb2.xml.gz",
      "extract": {
        "feed_name": "JPCERT/CC Eyes",
        "confirmation_channel": "cert",
        "content_length": 283466,
        "_note": "本文は解釈せず生バイトで保存している。意味づけは正規化が行う。"
      },
      "parser_version": "channel-feed-v1"
    },
    {
      "evidence_id": "ev-20260912-38b6a",
      "source_url": "https://jvn.jp/rss/jvn.rdf",
      "source_type": "cert",
      "retrieved_at_utc": "2026-09-11T23:10:12Z",
      "content_sha256": "38b6a60515aa069684d27107b636338148163542ef43adabcc6261615b7e0c30",
      "http_etag": "\"c879e0471473ddb59b635f9077e49a63132d5e15\"",
      "http_last_modified": "Fri, 11 Sep 2026 03:00:09 GMT",
      "snapshot_path": "forecaster/evidence/snapshots/feed/2026/09/38b6a60515aa069684d27107b636338148163542ef43adabcc6261615b7e0c30.xml.gz",
      "extract": {
        "feed_name": "JVN",
        "confirmation_channel": "cert",
        "content_length": 15865,
        "_note": "本文は解釈せず生バイトで保存している。意味づけは正規化が行う。"
      },
      "parser_version": "channel-feed-v1"
    },
    {
      "evidence_id": "ev-20260912-4a795",
      "source_url": "https://jvndb.jvn.jp/ja/rss/jvndb_new.rdf",
      "source_type": "cert",
      "retrieved_at_utc": "2026-09-11T23:10:15Z",
      "content_sha256": "4a795afbfe43167c52450879021d0a188757e9fe4b8d02bc51c50366f9beda7e",
      "http_etag": "\"106fec-65b307a8eca40\"",
      "http_last_modified": "Fri, 11 Sep 2026 08:00:33 GMT",
      "snapshot_path": "forecaster/evidence/snapshots/feed/2026/09/4a795afbfe43167c52450879021d0a188757e9fe4b8d02bc51c50366f9beda7e.xml.gz",
      "extract": {
        "feed_name": "JVN iPedia 新着",
        "confirmation_channel": "cert",
        "content_length": 1077228,
        "_note": "本文は解釈せず生バイトで保存している。意味づけは正規化が行う。"
      },
      "parser_version": "channel-feed-v1"
    },
    {
      "evidence_id": "ev-20260912-4b4d4",
      "source_url": "https://www.ipa.go.jp/security/rss/alert.rdf",
      "source_type": "cert",
      "retrieved_at_utc": "2026-09-11T23:10:16Z",
      "content_sha256": "4b4d420be955358b15f801c9a45930764a15d0290313504d2471450b4d3c82ed",
      "http_etag": null,
      "http_last_modified": "Wed, 09 Sep 2026 03:02:53 GMT",
      "snapshot_path": "forecaster/evidence/snapshots/feed/2026/09/4b4d420be955358b15f801c9a45930764a15d0290313504d2471450b4d3c82ed.xml.gz",
      "extract": {
        "feed_name": "IPA 重要なセキュリティ情報",
        "confirmation_channel": "cert",
        "content_length": 128088,
        "_note": "本文は解釈せず生バイトで保存している。意味づけは正規化が行う。"
      },
      "parser_version": "channel-feed-v1"
    },
    {
      "evidence_id": "ev-20260912-e26a5",
      "source_url": "https://unit42.paloaltonetworks.com/feed/",
      "source_type": "vendor",
      "retrieved_at_utc": "2026-09-11T23:10:16Z",
      "content_sha256": "e26a5f8735ba6aeeb37a5115e612148420bb246adc45e8d02e394a2037be7d74",
      "http_etag": "\"aad06682bb6e96a360a055c27b260342-gzip\"",
      "http_last_modified": "Thu, 10 Sep 2026 15:06:28 GMT",
      "snapshot_path": "forecaster/evidence/snapshots/feed/2026/09/e26a5f8735ba6aeeb37a5115e612148420bb246adc45e8d02e394a2037be7d74.xml.gz",
      "extract": {
        "feed_name": "Unit 42",
        "confirmation_channel": "vendor",
        "content_length": 24716,
        "_note": "本文は解釈せず生バイトで保存している。意味づけは正規化が行う。"
      },
      "parser_version": "channel-feed-v1"
    },
    {
      "evidence_id": "ev-20260912-b949d",
      "source_url": "https://labs.watchtowr.com/rss/",
      "source_type": "vendor",
      "retrieved_at_utc": "2026-09-11T23:10:16Z",
      "content_sha256": "b949ddcdcca3c4a7a2626e1fdf1f1eb788c77679bb82ac68395474aed0d6010b",
      "http_etag": null,
      "http_last_modified": null,
      "snapshot_path": "forecaster/evidence/snapshots/feed/2026/09/b949ddcdcca3c4a7a2626e1fdf1f1eb788c77679bb82ac68395474aed0d6010b.xml.gz",
      "extract": {
        "feed_name": "watchTowr Labs",
        "confirmation_channel": "vendor",
        "content_length": 586472,
        "_note": "本文は解釈せず生バイトで保存している。意味づけは正規化が行う。"
      },
      "parser_version": "channel-feed-v1"
    },
    {
      "evidence_id": "ev-20260912-7e473",
      "source_url": "https://cloudblog.withgoogle.com/topics/threat-intelligence/rss/",
      "source_type": "vendor",
      "retrieved_at_utc": "2026-09-11T23:10:20Z",
      "content_sha256": "7e473e3023b1f71a23cbc888b37d3fb76a2fcd815bbed5e113513658afb8cd15",
      "http_etag": null,
      "http_last_modified": null,
      "snapshot_path": "forecaster/evidence/snapshots/feed/2026/09/7e473e3023b1f71a23cbc888b37d3fb76a2fcd815bbed5e113513658afb8cd15.xml.gz",
      "extract": {
        "feed_name": "Google Threat Intelligence (Mandiant)",
        "confirmation_channel": "vendor",
        "content_length": 1251760,
        "_note": "本文は解釈せず生バイトで保存している。意味づけは正規化が行う。"
      },
      "parser_version": "channel-feed-v1"
    },
    {
      "evidence_id": "ev-20260912-c76d0",
      "source_url": "https://isc.sans.edu/rssfeed.xml",
      "source_type": "telemetry",
      "retrieved_at_utc": "2026-09-11T23:10:20Z",
      "content_sha256": "c76d04da951131ab40f90c2bc0d172d936d1e87e8ffcc95fd6492edbef57db4c",
      "http_etag": "\"1d9e-65b3d2b698012\"",
      "http_last_modified": "Fri, 11 Sep 2026 23:08:59 GMT",
      "snapshot_path": "forecaster/evidence/snapshots/feed/2026/09/c76d04da951131ab40f90c2bc0d172d936d1e87e8ffcc95fd6492edbef57db4c.xml.gz",
      "extract": {
        "feed_name": "SANS Internet Storm Center",
        "confirmation_channel": "telemetry_provider",
        "content_length": 7582,
        "_note": "本文は解釈せず生バイトで保存している。意味づけは正規化が行う。"
      },
      "parser_version": "channel-feed-v1"
    }
  ]
}
