{
  "_schema_version": "1.0",
  "_evidence_date": "2026-09-26",
  "_generated_at_utc": "2026-09-25T21:09:07Z",
  "_generator": "scripts/snapshot_sources.py",
  "evidence": [
    {
      "evidence_id": "ev-20260926-8a41e",
      "source_url": "https://www.cisa.gov/sites/default/files/feeds/known_exploited_vulnerabilities.json",
      "source_type": "cisa_kev",
      "published_at_utc": "2026-09-25T18:58:16.5029Z",
      "retrieved_at_utc": "2026-09-25T21:08:53Z",
      "content_sha256": "8a41e76a385f304a9f436f33640ed6bec1ca94d9dee699a4e9ecb908c9d51395",
      "http_etag": "\"1abf00-65c534c8b3b50\"",
      "http_last_modified": "Fri, 25 Sep 2026 18:58:16 GMT",
      "snapshot_path": "forecaster/evidence/snapshots/kev/2026/09/8a41e76a385f304a9f436f33640ed6bec1ca94d9dee699a4e9ecb908c9d51395.json.gz",
      "extract": {
        "catalog_version": "2026.09.25",
        "date_released": "2026-09-25T18:58:16.5029Z",
        "count": 1726,
        "max_date_added": "2026-09-25",
        "_full_catalog_note": "全件の cveID→dateAdded は snapshot_path のスナップショットに入っている。load_kev_snapshot() で読むこと（manifest へは重複保存しない）。"
      },
      "parser_version": "kev-extract-v1"
    },
    {
      "evidence_id": "ev-20260926-59bd6",
      "source_url": "https://www.jpcert.or.jp/rss/jpcert.rdf",
      "source_type": "cert",
      "retrieved_at_utc": "2026-09-25T21:08:57Z",
      "content_sha256": "59bd6c86c21dff174f16fc162f509882e6d0c4bd16b3a87aab71f8ff7a2d1acd",
      "http_etag": "\"4abc-65c470d218d40\"",
      "http_last_modified": "Fri, 25 Sep 2026 04:21:33 GMT",
      "snapshot_path": "forecaster/evidence/snapshots/feed/2026/09/59bd6c86c21dff174f16fc162f509882e6d0c4bd16b3a87aab71f8ff7a2d1acd.xml.gz",
      "extract": {
        "feed_name": "JPCERT/CC",
        "confirmation_channel": "cert",
        "content_length": 19132,
        "_note": "本文は解釈せず生バイトで保存している。意味づけは正規化が行う。"
      },
      "parser_version": "channel-feed-v1"
    },
    {
      "evidence_id": "ev-20260926-6bb3b",
      "source_url": "https://blogs.jpcert.or.jp/ja/atom.xml",
      "source_type": "cert",
      "retrieved_at_utc": "2026-09-25T21:08:59Z",
      "content_sha256": "6bb3bc399cdc32f5b7b9c4baa5a070ec776106f58aa8bd1eeadd7f826497f1bd",
      "http_etag": null,
      "http_last_modified": null,
      "snapshot_path": "forecaster/evidence/snapshots/feed/2026/09/6bb3bc399cdc32f5b7b9c4baa5a070ec776106f58aa8bd1eeadd7f826497f1bd.xml.gz",
      "extract": {
        "feed_name": "JPCERT/CC Eyes",
        "confirmation_channel": "cert",
        "content_length": 283466,
        "_note": "本文は解釈せず生バイトで保存している。意味づけは正規化が行う。"
      },
      "parser_version": "channel-feed-v1"
    },
    {
      "evidence_id": "ev-20260926-4f35a",
      "source_url": "https://jvn.jp/rss/jvn.rdf",
      "source_type": "cert",
      "retrieved_at_utc": "2026-09-25T21:08:59Z",
      "content_sha256": "4f35a87b0d413692c25a2e8271033c18357ce89c72bf34f4f3d3d5ebe5f1288e",
      "http_etag": "\"794da6134bc88b22ac1060199598aea5c0ae0d53\"",
      "http_last_modified": "Fri, 25 Sep 2026 03:00:07 GMT",
      "snapshot_path": "forecaster/evidence/snapshots/feed/2026/09/4f35a87b0d413692c25a2e8271033c18357ce89c72bf34f4f3d3d5ebe5f1288e.xml.gz",
      "extract": {
        "feed_name": "JVN",
        "confirmation_channel": "cert",
        "content_length": 16226,
        "_note": "本文は解釈せず生バイトで保存している。意味づけは正規化が行う。"
      },
      "parser_version": "channel-feed-v1"
    },
    {
      "evidence_id": "ev-20260926-380e8",
      "source_url": "https://jvndb.jvn.jp/ja/rss/jvndb_new.rdf",
      "source_type": "cert",
      "retrieved_at_utc": "2026-09-25T21:09:03Z",
      "content_sha256": "380e8686d130feed06b2589c84281397d3dc4d99d2fd8abdfc2daa7fa0f273f4",
      "http_etag": "\"105764-65c4a1c46c800\"",
      "http_last_modified": "Fri, 25 Sep 2026 08:00:32 GMT",
      "snapshot_path": "forecaster/evidence/snapshots/feed/2026/09/380e8686d130feed06b2589c84281397d3dc4d99d2fd8abdfc2daa7fa0f273f4.xml.gz",
      "extract": {
        "feed_name": "JVN iPedia 新着",
        "confirmation_channel": "cert",
        "content_length": 1070948,
        "_note": "本文は解釈せず生バイトで保存している。意味づけは正規化が行う。"
      },
      "parser_version": "channel-feed-v1"
    },
    {
      "evidence_id": "ev-20260926-4b4d4",
      "source_url": "https://www.ipa.go.jp/security/rss/alert.rdf",
      "source_type": "cert",
      "retrieved_at_utc": "2026-09-25T21:09:04Z",
      "content_sha256": "4b4d420be955358b15f801c9a45930764a15d0290313504d2471450b4d3c82ed",
      "http_etag": null,
      "http_last_modified": "Wed, 09 Sep 2026 03:02:53 GMT",
      "snapshot_path": "forecaster/evidence/snapshots/feed/2026/09/4b4d420be955358b15f801c9a45930764a15d0290313504d2471450b4d3c82ed.xml.gz",
      "extract": {
        "feed_name": "IPA 重要なセキュリティ情報",
        "confirmation_channel": "cert",
        "content_length": 128088,
        "_note": "本文は解釈せず生バイトで保存している。意味づけは正規化が行う。"
      },
      "parser_version": "channel-feed-v1"
    },
    {
      "evidence_id": "ev-20260926-dcc32",
      "source_url": "https://unit42.paloaltonetworks.com/feed/",
      "source_type": "vendor",
      "retrieved_at_utc": "2026-09-25T21:09:05Z",
      "content_sha256": "dcc322a5230a8e055ab97b1f5be02d50842b25465b8e305151e6887ba7ee6936",
      "http_etag": "\"65f3f1bf39c619488a7010ee2626ebbc-gzip\"",
      "http_last_modified": "Mon, 21 Sep 2026 21:59:44 GMT",
      "snapshot_path": "forecaster/evidence/snapshots/feed/2026/09/dcc322a5230a8e055ab97b1f5be02d50842b25465b8e305151e6887ba7ee6936.xml.gz",
      "extract": {
        "feed_name": "Unit 42",
        "confirmation_channel": "vendor",
        "content_length": 24915,
        "_note": "本文は解釈せず生バイトで保存している。意味づけは正規化が行う。"
      },
      "parser_version": "channel-feed-v1"
    },
    {
      "evidence_id": "ev-20260926-55e7e",
      "source_url": "https://labs.watchtowr.com/rss/",
      "source_type": "vendor",
      "retrieved_at_utc": "2026-09-25T21:09:05Z",
      "content_sha256": "55e7e9e16e2fc8ddd0feb75e724a0fbd01722b623058e0db7356ba3def32979b",
      "http_etag": null,
      "http_last_modified": null,
      "snapshot_path": "forecaster/evidence/snapshots/feed/2026/09/55e7e9e16e2fc8ddd0feb75e724a0fbd01722b623058e0db7356ba3def32979b.xml.gz",
      "extract": {
        "feed_name": "watchTowr Labs",
        "confirmation_channel": "vendor",
        "content_length": 544175,
        "_note": "本文は解釈せず生バイトで保存している。意味づけは正規化が行う。"
      },
      "parser_version": "channel-feed-v1"
    },
    {
      "evidence_id": "ev-20260926-02854",
      "source_url": "https://cloudblog.withgoogle.com/topics/threat-intelligence/rss/",
      "source_type": "vendor",
      "retrieved_at_utc": "2026-09-25T21:09:07Z",
      "content_sha256": "02854c6f8dd1b7050887dd892d1f17b0725ecb308ac9a3cfd74e7439b6824849",
      "http_etag": null,
      "http_last_modified": null,
      "snapshot_path": "forecaster/evidence/snapshots/feed/2026/09/02854c6f8dd1b7050887dd892d1f17b0725ecb308ac9a3cfd74e7439b6824849.xml.gz",
      "extract": {
        "feed_name": "Google Threat Intelligence (Mandiant)",
        "confirmation_channel": "vendor",
        "content_length": 1249418,
        "_note": "本文は解釈せず生バイトで保存している。意味づけは正規化が行う。"
      },
      "parser_version": "channel-feed-v1"
    },
    {
      "evidence_id": "ev-20260926-d17f8",
      "source_url": "https://isc.sans.edu/rssfeed.xml",
      "source_type": "telemetry",
      "retrieved_at_utc": "2026-09-25T21:09:07Z",
      "content_sha256": "d17f865480f24f28d32625d41cbaa3f2d1a76c9d68fef21a92a911fce3cd6257",
      "http_etag": "\"1c68-65c550e2b504b\"",
      "http_last_modified": "Fri, 25 Sep 2026 21:03:59 GMT",
      "snapshot_path": "forecaster/evidence/snapshots/feed/2026/09/d17f865480f24f28d32625d41cbaa3f2d1a76c9d68fef21a92a911fce3cd6257.xml.gz",
      "extract": {
        "feed_name": "SANS Internet Storm Center",
        "confirmation_channel": "telemetry_provider",
        "content_length": 7272,
        "_note": "本文は解釈せず生バイトで保存している。意味づけは正規化が行う。"
      },
      "parser_version": "channel-feed-v1"
    }
  ]
}
