{
  "_schema_version": "1.0",
  "_evidence_date": "2026-09-25",
  "_generated_at_utc": "2026-09-24T21:10:20Z",
  "_generator": "scripts/snapshot_sources.py",
  "evidence": [
    {
      "evidence_id": "ev-20260925-39099",
      "source_url": "https://www.cisa.gov/sites/default/files/feeds/known_exploited_vulnerabilities.json",
      "source_type": "cisa_kev",
      "published_at_utc": "2026-09-24T19:00:55.0481Z",
      "retrieved_at_utc": "2026-09-24T21:10:04Z",
      "content_sha256": "39099ffcf82c3f183fa6f7326900a6d82731517b2edb5cecde06dee6e04289d1",
      "http_etag": "\"1aab25-65c3f38275608\"",
      "http_last_modified": "Thu, 24 Sep 2026 19:00:55 GMT",
      "snapshot_path": "forecaster/evidence/snapshots/kev/2026/09/39099ffcf82c3f183fa6f7326900a6d82731517b2edb5cecde06dee6e04289d1.json.gz",
      "extract": {
        "catalog_version": "2026.09.24",
        "date_released": "2026-09-24T19:00:55.0481Z",
        "count": 1723,
        "max_date_added": "2026-09-24",
        "_full_catalog_note": "全件の cveID→dateAdded は snapshot_path のスナップショットに入っている。load_kev_snapshot() で読むこと（manifest へは重複保存しない）。"
      },
      "parser_version": "kev-extract-v1"
    },
    {
      "evidence_id": "ev-20260925-59bd6",
      "source_url": "https://www.jpcert.or.jp/rss/jpcert.rdf",
      "source_type": "cert",
      "retrieved_at_utc": "2026-09-24T21:10:07Z",
      "content_sha256": "59bd6c86c21dff174f16fc162f509882e6d0c4bd16b3a87aab71f8ff7a2d1acd",
      "http_etag": "\"4abc-65c35a5af11c0\"",
      "http_last_modified": "Thu, 24 Sep 2026 07:35:43 GMT",
      "snapshot_path": "forecaster/evidence/snapshots/feed/2026/09/59bd6c86c21dff174f16fc162f509882e6d0c4bd16b3a87aab71f8ff7a2d1acd.xml.gz",
      "extract": {
        "feed_name": "JPCERT/CC",
        "confirmation_channel": "cert",
        "content_length": 19132,
        "_note": "本文は解釈せず生バイトで保存している。意味づけは正規化が行う。"
      },
      "parser_version": "channel-feed-v1"
    },
    {
      "evidence_id": "ev-20260925-6bb3b",
      "source_url": "https://blogs.jpcert.or.jp/ja/atom.xml",
      "source_type": "cert",
      "retrieved_at_utc": "2026-09-24T21:10:09Z",
      "content_sha256": "6bb3bc399cdc32f5b7b9c4baa5a070ec776106f58aa8bd1eeadd7f826497f1bd",
      "http_etag": null,
      "http_last_modified": null,
      "snapshot_path": "forecaster/evidence/snapshots/feed/2026/09/6bb3bc399cdc32f5b7b9c4baa5a070ec776106f58aa8bd1eeadd7f826497f1bd.xml.gz",
      "extract": {
        "feed_name": "JPCERT/CC Eyes",
        "confirmation_channel": "cert",
        "content_length": 283466,
        "_note": "本文は解釈せず生バイトで保存している。意味づけは正規化が行う。"
      },
      "parser_version": "channel-feed-v1"
    },
    {
      "evidence_id": "ev-20260925-b10d7",
      "source_url": "https://jvn.jp/rss/jvn.rdf",
      "source_type": "cert",
      "retrieved_at_utc": "2026-09-24T21:10:11Z",
      "content_sha256": "b10d7bde7071d88c61b65a8e0164ba487753c5c8cbd686566f74e944d8e40fac",
      "http_etag": "\"b32d5fccfcec96743e3159dcff974bb0af8b792f\"",
      "http_last_modified": "Thu, 24 Sep 2026 04:00:10 GMT",
      "snapshot_path": "forecaster/evidence/snapshots/feed/2026/09/b10d7bde7071d88c61b65a8e0164ba487753c5c8cbd686566f74e944d8e40fac.xml.gz",
      "extract": {
        "feed_name": "JVN",
        "confirmation_channel": "cert",
        "content_length": 16486,
        "_note": "本文は解釈せず生バイトで保存している。意味づけは正規化が行う。"
      },
      "parser_version": "channel-feed-v1"
    },
    {
      "evidence_id": "ev-20260925-b92b8",
      "source_url": "https://jvndb.jvn.jp/ja/rss/jvndb_new.rdf",
      "source_type": "cert",
      "retrieved_at_utc": "2026-09-24T21:10:16Z",
      "content_sha256": "b92b83fbd63c03bcfa73736a0ad0c2c25c80c355c30b227359fc349529af7d4f",
      "http_etag": "\"106a6d-65c35fe6f6800\"",
      "http_last_modified": "Thu, 24 Sep 2026 08:00:32 GMT",
      "snapshot_path": "forecaster/evidence/snapshots/feed/2026/09/b92b83fbd63c03bcfa73736a0ad0c2c25c80c355c30b227359fc349529af7d4f.xml.gz",
      "extract": {
        "feed_name": "JVN iPedia 新着",
        "confirmation_channel": "cert",
        "content_length": 1075821,
        "_note": "本文は解釈せず生バイトで保存している。意味づけは正規化が行う。"
      },
      "parser_version": "channel-feed-v1"
    },
    {
      "evidence_id": "ev-20260925-4b4d4",
      "source_url": "https://www.ipa.go.jp/security/rss/alert.rdf",
      "source_type": "cert",
      "retrieved_at_utc": "2026-09-24T21:10:17Z",
      "content_sha256": "4b4d420be955358b15f801c9a45930764a15d0290313504d2471450b4d3c82ed",
      "http_etag": null,
      "http_last_modified": "Wed, 09 Sep 2026 03:02:53 GMT",
      "snapshot_path": "forecaster/evidence/snapshots/feed/2026/09/4b4d420be955358b15f801c9a45930764a15d0290313504d2471450b4d3c82ed.xml.gz",
      "extract": {
        "feed_name": "IPA 重要なセキュリティ情報",
        "confirmation_channel": "cert",
        "content_length": 128088,
        "_note": "本文は解釈せず生バイトで保存している。意味づけは正規化が行う。"
      },
      "parser_version": "channel-feed-v1"
    },
    {
      "evidence_id": "ev-20260925-dcc32",
      "source_url": "https://unit42.paloaltonetworks.com/feed/",
      "source_type": "vendor",
      "retrieved_at_utc": "2026-09-24T21:10:18Z",
      "content_sha256": "dcc322a5230a8e055ab97b1f5be02d50842b25465b8e305151e6887ba7ee6936",
      "http_etag": "\"65f3f1bf39c619488a7010ee2626ebbc-gzip\"",
      "http_last_modified": "Mon, 21 Sep 2026 21:59:44 GMT",
      "snapshot_path": "forecaster/evidence/snapshots/feed/2026/09/dcc322a5230a8e055ab97b1f5be02d50842b25465b8e305151e6887ba7ee6936.xml.gz",
      "extract": {
        "feed_name": "Unit 42",
        "confirmation_channel": "vendor",
        "content_length": 24915,
        "_note": "本文は解釈せず生バイトで保存している。意味づけは正規化が行う。"
      },
      "parser_version": "channel-feed-v1"
    },
    {
      "evidence_id": "ev-20260925-3039c",
      "source_url": "https://labs.watchtowr.com/rss/",
      "source_type": "vendor",
      "retrieved_at_utc": "2026-09-24T21:10:18Z",
      "content_sha256": "3039cd36fb563e0eb0b8f803e15829f432f4df093072408f1b23ef8792b22579",
      "http_etag": null,
      "http_last_modified": null,
      "snapshot_path": "forecaster/evidence/snapshots/feed/2026/09/3039cd36fb563e0eb0b8f803e15829f432f4df093072408f1b23ef8792b22579.xml.gz",
      "extract": {
        "feed_name": "watchTowr Labs",
        "confirmation_channel": "vendor",
        "content_length": 544175,
        "_note": "本文は解釈せず生バイトで保存している。意味づけは正規化が行う。"
      },
      "parser_version": "channel-feed-v1"
    },
    {
      "evidence_id": "ev-20260925-d3ed8",
      "source_url": "https://cloudblog.withgoogle.com/topics/threat-intelligence/rss/",
      "source_type": "vendor",
      "retrieved_at_utc": "2026-09-24T21:10:20Z",
      "content_sha256": "d3ed8e3be91f3ac422411e86ad1e6585937d6a40d97dad3ee44bb4d9de860589",
      "http_etag": null,
      "http_last_modified": null,
      "snapshot_path": "forecaster/evidence/snapshots/feed/2026/09/d3ed8e3be91f3ac422411e86ad1e6585937d6a40d97dad3ee44bb4d9de860589.xml.gz",
      "extract": {
        "feed_name": "Google Threat Intelligence (Mandiant)",
        "confirmation_channel": "vendor",
        "content_length": 1249418,
        "_note": "本文は解釈せず生バイトで保存している。意味づけは正規化が行う。"
      },
      "parser_version": "channel-feed-v1"
    },
    {
      "evidence_id": "ev-20260925-689b8",
      "source_url": "https://isc.sans.edu/rssfeed.xml",
      "source_type": "telemetry",
      "retrieved_at_utc": "2026-09-24T21:10:20Z",
      "content_sha256": "689b81d8983995ccfaea2c95a02154e4073b869793c1a7970832aa2c97b282b4",
      "http_etag": "\"1e14-65c410224a306\"",
      "http_last_modified": "Thu, 24 Sep 2026 21:08:58 GMT",
      "snapshot_path": "forecaster/evidence/snapshots/feed/2026/09/689b81d8983995ccfaea2c95a02154e4073b869793c1a7970832aa2c97b282b4.xml.gz",
      "extract": {
        "feed_name": "SANS Internet Storm Center",
        "confirmation_channel": "telemetry_provider",
        "content_length": 7700,
        "_note": "本文は解釈せず生バイトで保存している。意味づけは正規化が行う。"
      },
      "parser_version": "channel-feed-v1"
    }
  ]
}
