{
  "_schema_version": "1.0",
  "_evidence_date": "2026-10-10",
  "_generated_at_utc": "2026-10-10T00:40:53Z",
  "_generator": "scripts/snapshot_sources.py",
  "evidence": [
    {
      "evidence_id": "ev-20261010-fb162",
      "source_url": "https://www.cisa.gov/sites/default/files/feeds/known_exploited_vulnerabilities.json",
      "source_type": "cisa_kev",
      "published_at_utc": "2026-10-08T20:09:18.9833Z",
      "retrieved_at_utc": "2026-10-10T00:40:46Z",
      "content_sha256": "fb1621beec7db19d99c1f919dede3d4cc01ad88acd16f79f1592929c4826dfee",
      "http_etag": "\"1b1f96-65d59ce8c2338\"",
      "http_last_modified": "Thu, 08 Oct 2026 20:09:19 GMT",
      "snapshot_path": "forecaster/evidence/snapshots/kev/2026/10/fb1621beec7db19d99c1f919dede3d4cc01ad88acd16f79f1592929c4826dfee.json.gz",
      "extract": {
        "catalog_version": "2026.10.08",
        "date_released": "2026-10-08T20:09:18.9833Z",
        "count": 1739,
        "max_date_added": "2026-10-08",
        "_full_catalog_note": "全件の cveID→dateAdded は snapshot_path のスナップショットに入っている。load_kev_snapshot() で読むこと（manifest へは重複保存しない）。"
      },
      "parser_version": "kev-extract-v1"
    },
    {
      "evidence_id": "ev-20261010-768e0",
      "source_url": "https://www.jpcert.or.jp/rss/jpcert.rdf",
      "source_type": "cert",
      "retrieved_at_utc": "2026-10-10T00:40:47Z",
      "content_sha256": "768e04e96567adc21a7b4a5d66d47441947d146e54f649520379a13bf0fa4932",
      "http_etag": "\"374d-65d5e0efc7900\"",
      "http_last_modified": "Fri, 09 Oct 2026 01:13:40 GMT",
      "snapshot_path": "forecaster/evidence/snapshots/feed/2026/10/768e04e96567adc21a7b4a5d66d47441947d146e54f649520379a13bf0fa4932.xml.gz",
      "extract": {
        "feed_name": "JPCERT/CC",
        "confirmation_channel": "cert",
        "content_length": 14157,
        "_note": "本文は解釈せず生バイトで保存している。意味づけは正規化が行う。"
      },
      "parser_version": "channel-feed-v1"
    },
    {
      "evidence_id": "ev-20261010-6bb3b",
      "source_url": "https://blogs.jpcert.or.jp/ja/atom.xml",
      "source_type": "cert",
      "retrieved_at_utc": "2026-10-10T00:40:48Z",
      "content_sha256": "6bb3bc399cdc32f5b7b9c4baa5a070ec776106f58aa8bd1eeadd7f826497f1bd",
      "http_etag": null,
      "http_last_modified": null,
      "snapshot_path": "forecaster/evidence/snapshots/feed/2026/09/6bb3bc399cdc32f5b7b9c4baa5a070ec776106f58aa8bd1eeadd7f826497f1bd.xml.gz",
      "extract": {
        "feed_name": "JPCERT/CC Eyes",
        "confirmation_channel": "cert",
        "content_length": 283466,
        "_note": "本文は解釈せず生バイトで保存している。意味づけは正規化が行う。"
      },
      "parser_version": "channel-feed-v1"
    },
    {
      "evidence_id": "ev-20261010-2d38b",
      "source_url": "https://jvn.jp/rss/jvn.rdf",
      "source_type": "cert",
      "retrieved_at_utc": "2026-10-10T00:40:49Z",
      "content_sha256": "2d38b41f0c1ab05f5e523ac6d2d476416c5cb91dd065f59ba51046d07022fc99",
      "http_etag": "\"c1b427d607221e34550a79ffd4f5c797cbec9d44\"",
      "http_last_modified": "Fri, 09 Oct 2026 00:00:09 GMT",
      "snapshot_path": "forecaster/evidence/snapshots/feed/2026/10/2d38b41f0c1ab05f5e523ac6d2d476416c5cb91dd065f59ba51046d07022fc99.xml.gz",
      "extract": {
        "feed_name": "JVN",
        "confirmation_channel": "cert",
        "content_length": 16256,
        "_note": "本文は解釈せず生バイトで保存している。意味づけは正規化が行う。"
      },
      "parser_version": "channel-feed-v1"
    },
    {
      "evidence_id": "ev-20261010-7f69a",
      "source_url": "https://jvndb.jvn.jp/ja/rss/jvndb_new.rdf",
      "source_type": "cert",
      "retrieved_at_utc": "2026-10-10T00:40:52Z",
      "content_sha256": "7f69a25850236e4da994e8646a93fef9d2d0c94813d05a3adf4de71888e10e5c",
      "http_etag": "\"ea673-65d63be1d4a40\"",
      "http_last_modified": "Fri, 09 Oct 2026 08:00:33 GMT",
      "snapshot_path": "forecaster/evidence/snapshots/feed/2026/10/7f69a25850236e4da994e8646a93fef9d2d0c94813d05a3adf4de71888e10e5c.xml.gz",
      "extract": {
        "feed_name": "JVN iPedia 新着",
        "confirmation_channel": "cert",
        "content_length": 960115,
        "_note": "本文は解釈せず生バイトで保存している。意味づけは正規化が行う。"
      },
      "parser_version": "channel-feed-v1"
    },
    {
      "evidence_id": "ev-20261010-cc482",
      "source_url": "https://www.ipa.go.jp/security/rss/alert.rdf",
      "source_type": "cert",
      "retrieved_at_utc": "2026-10-10T00:40:52Z",
      "content_sha256": "cc482eb724000a9cc17d47905b164d643db26f8079c920aa675e71069953940c",
      "http_etag": null,
      "http_last_modified": "Fri, 09 Oct 2026 06:15:54 GMT",
      "snapshot_path": "forecaster/evidence/snapshots/feed/2026/10/cc482eb724000a9cc17d47905b164d643db26f8079c920aa675e71069953940c.xml.gz",
      "extract": {
        "feed_name": "IPA 重要なセキュリティ情報",
        "confirmation_channel": "cert",
        "content_length": 129657,
        "_note": "本文は解釈せず生バイトで保存している。意味づけは正規化が行う。"
      },
      "parser_version": "channel-feed-v1"
    },
    {
      "evidence_id": "ev-20261010-fdc00",
      "source_url": "https://unit42.paloaltonetworks.com/feed/",
      "source_type": "vendor",
      "retrieved_at_utc": "2026-10-10T00:40:52Z",
      "content_sha256": "fdc00fc105869aadb1bcbe34b1fc123a562ce5eacac7da8283756de741ee32f0",
      "http_etag": "\"a19c23ad47fe9fe83b903a8c7b2e8f8c-gzip\"",
      "http_last_modified": "Fri, 09 Oct 2026 20:56:22 GMT",
      "snapshot_path": "forecaster/evidence/snapshots/feed/2026/10/fdc00fc105869aadb1bcbe34b1fc123a562ce5eacac7da8283756de741ee32f0.xml.gz",
      "extract": {
        "feed_name": "Unit 42",
        "confirmation_channel": "vendor",
        "content_length": 24911,
        "_note": "本文は解釈せず生バイトで保存している。意味づけは正規化が行う。"
      },
      "parser_version": "channel-feed-v1"
    },
    {
      "evidence_id": "ev-20261010-0fcea",
      "source_url": "https://labs.watchtowr.com/rss/",
      "source_type": "vendor",
      "retrieved_at_utc": "2026-10-10T00:40:52Z",
      "content_sha256": "0fcea78ae28e63a7b2c87c4af3c1b39488bef5d08815e3d16ffd28a5efb0c005",
      "http_etag": null,
      "http_last_modified": null,
      "snapshot_path": "forecaster/evidence/snapshots/feed/2026/10/0fcea78ae28e63a7b2c87c4af3c1b39488bef5d08815e3d16ffd28a5efb0c005.xml.gz",
      "extract": {
        "feed_name": "watchTowr Labs",
        "confirmation_channel": "vendor",
        "content_length": 516052,
        "_note": "本文は解釈せず生バイトで保存している。意味づけは正規化が行う。"
      },
      "parser_version": "channel-feed-v1"
    },
    {
      "evidence_id": "ev-20261010-e45f6",
      "source_url": "https://cloudblog.withgoogle.com/topics/threat-intelligence/rss/",
      "source_type": "vendor",
      "retrieved_at_utc": "2026-10-10T00:40:53Z",
      "content_sha256": "e45f6a14b76706d787db69863ade86c82458b59a49796de7acaf76a89fa23658",
      "http_etag": null,
      "http_last_modified": null,
      "snapshot_path": "forecaster/evidence/snapshots/feed/2026/10/e45f6a14b76706d787db69863ade86c82458b59a49796de7acaf76a89fa23658.xml.gz",
      "extract": {
        "feed_name": "Google Threat Intelligence (Mandiant)",
        "confirmation_channel": "vendor",
        "content_length": 1362027,
        "_note": "本文は解釈せず生バイトで保存している。意味づけは正規化が行う。"
      },
      "parser_version": "channel-feed-v1"
    },
    {
      "evidence_id": "ev-20261010-82679",
      "source_url": "https://isc.sans.edu/rssfeed.xml",
      "source_type": "telemetry",
      "retrieved_at_utc": "2026-10-10T00:40:53Z",
      "content_sha256": "82679170652c7889b5173262db16f1dc4d8f39a90310658116c74839a0526540",
      "http_etag": "\"202c-65d71b0c4eb35\"",
      "http_last_modified": "Sat, 10 Oct 2026 00:38:58 GMT",
      "snapshot_path": "forecaster/evidence/snapshots/feed/2026/10/82679170652c7889b5173262db16f1dc4d8f39a90310658116c74839a0526540.xml.gz",
      "extract": {
        "feed_name": "SANS Internet Storm Center",
        "confirmation_channel": "telemetry_provider",
        "content_length": 8236,
        "_note": "本文は解釈せず生バイトで保存している。意味づけは正規化が行う。"
      },
      "parser_version": "channel-feed-v1"
    }
  ]
}
