{
  "_schema_version": "1.0",
  "_evidence_date": "2026-10-29",
  "_generated_at_utc": "2026-10-29T00:26:54Z",
  "_generator": "scripts/snapshot_sources.py",
  "evidence": [
    {
      "evidence_id": "ev-20261029-c72e8",
      "source_url": "https://www.cisa.gov/sites/default/files/feeds/known_exploited_vulnerabilities.json",
      "source_type": "cisa_kev",
      "published_at_utc": "2026-10-28T19:00:04.8077Z",
      "retrieved_at_utc": "2026-10-28T19:53:51Z",
      "content_sha256": "c72e8b7751209e7575ed777439e3f4e9295ba86b4edf5d52730959d8bf9bfe64",
      "http_etag": "\"1bc151-65eeb2bc3d9c8\"",
      "http_last_modified": "Wed, 28 Oct 2026 19:00:04 GMT",
      "snapshot_path": "forecaster/evidence/snapshots/kev/2026/10/c72e8b7751209e7575ed777439e3f4e9295ba86b4edf5d52730959d8bf9bfe64.json.gz",
      "extract": {
        "catalog_version": "2026.10.28",
        "date_released": "2026-10-28T19:00:04.8077Z",
        "count": 1762,
        "max_date_added": "2026-10-28",
        "_full_catalog_note": "全件の cveID→dateAdded は snapshot_path のスナップショットに入っている。load_kev_snapshot() で読むこと（manifest へは重複保存しない）。",
        "reconfirmed_at_utc": [
          "2026-10-28T22:31:54Z",
          "2026-10-29T00:26:48Z"
        ]
      },
      "parser_version": "kev-extract-v1"
    },
    {
      "evidence_id": "ev-20261029-ac2a3",
      "source_url": "https://www.jpcert.or.jp/rss/jpcert.rdf",
      "source_type": "cert",
      "retrieved_at_utc": "2026-10-28T19:53:51Z",
      "content_sha256": "ac2a3d35f26d6f67eb9970fbc961f1a2d5b389fd94c6192f5afe5ab3404c1b10",
      "http_etag": "\"3724-65ee1f61cd080\"",
      "http_last_modified": "Wed, 28 Oct 2026 08:00:50 GMT",
      "snapshot_path": "forecaster/evidence/snapshots/feed/2026/10/ac2a3d35f26d6f67eb9970fbc961f1a2d5b389fd94c6192f5afe5ab3404c1b10.xml.gz",
      "extract": {
        "feed_name": "JPCERT/CC",
        "confirmation_channel": "cert",
        "content_length": 14116,
        "_note": "本文は解釈せず生バイトで保存している。意味づけは正規化が行う。",
        "reconfirmed_at_utc": [
          "2026-10-28T22:31:54Z",
          "2026-10-29T00:26:49Z"
        ]
      },
      "parser_version": "channel-feed-v1"
    },
    {
      "evidence_id": "ev-20261029-f428f",
      "source_url": "https://blogs.jpcert.or.jp/ja/atom.xml",
      "source_type": "cert",
      "retrieved_at_utc": "2026-10-28T19:53:52Z",
      "content_sha256": "f428f775ced12d614067cec5e38b4e560448f668353bce4e8c91064cb6c55f5a",
      "http_etag": null,
      "http_last_modified": null,
      "snapshot_path": "forecaster/evidence/snapshots/feed/2026/10/f428f775ced12d614067cec5e38b4e560448f668353bce4e8c91064cb6c55f5a.xml.gz",
      "extract": {
        "feed_name": "JPCERT/CC Eyes",
        "confirmation_channel": "cert",
        "content_length": 259860,
        "_note": "本文は解釈せず生バイトで保存している。意味づけは正規化が行う。",
        "reconfirmed_at_utc": [
          "2026-10-28T22:31:55Z",
          "2026-10-29T00:26:50Z"
        ]
      },
      "parser_version": "channel-feed-v1"
    },
    {
      "evidence_id": "ev-20261029-870b4",
      "source_url": "https://jvn.jp/rss/jvn.rdf",
      "source_type": "cert",
      "retrieved_at_utc": "2026-10-28T19:53:53Z",
      "content_sha256": "870b4b9e757b3e05932344cfe65a6932e1f5ef3b34f3ee8b8e41c25b0311d8a6",
      "http_etag": "\"fcbd07f76c1bf79607400ae59e47258a1db7bb6c\"",
      "http_last_modified": "Wed, 28 Oct 2026 07:30:03 GMT",
      "snapshot_path": "forecaster/evidence/snapshots/feed/2026/10/870b4b9e757b3e05932344cfe65a6932e1f5ef3b34f3ee8b8e41c25b0311d8a6.xml.gz",
      "extract": {
        "feed_name": "JVN",
        "confirmation_channel": "cert",
        "content_length": 16727,
        "_note": "本文は解釈せず生バイトで保存している。意味づけは正規化が行う。",
        "reconfirmed_at_utc": [
          "2026-10-28T22:31:55Z",
          "2026-10-29T00:26:50Z"
        ]
      },
      "parser_version": "channel-feed-v1"
    },
    {
      "evidence_id": "ev-20261029-a6e64",
      "source_url": "https://www.ipa.go.jp/security/rss/alert.rdf",
      "source_type": "cert",
      "retrieved_at_utc": "2026-10-28T19:53:54Z",
      "content_sha256": "a6e64e135385414e50cf801be0b61ed7796d88eb1781e0f6b496cb81c7fdc008",
      "http_etag": null,
      "http_last_modified": "Tue, 27 Oct 2026 03:11:41 GMT",
      "snapshot_path": "forecaster/evidence/snapshots/feed/2026/10/a6e64e135385414e50cf801be0b61ed7796d88eb1781e0f6b496cb81c7fdc008.xml.gz",
      "extract": {
        "feed_name": "IPA 重要なセキュリティ情報",
        "confirmation_channel": "cert",
        "content_length": 132151,
        "_note": "本文は解釈せず生バイトで保存している。意味づけは正規化が行う。",
        "reconfirmed_at_utc": [
          "2026-10-28T22:31:56Z",
          "2026-10-29T00:26:52Z"
        ]
      },
      "parser_version": "channel-feed-v1"
    },
    {
      "evidence_id": "ev-20261029-5dd54",
      "source_url": "https://unit42.paloaltonetworks.com/feed/",
      "source_type": "vendor",
      "retrieved_at_utc": "2026-10-28T19:53:54Z",
      "content_sha256": "5dd5467e6fd3cd75c35cd5253f86f9b90c619d10a51badefb54900e0230ead59",
      "http_etag": "\"aee262c7aa9389e9949ec7fdf03672d4-gzip\"",
      "http_last_modified": "Wed, 28 Oct 2026 18:00:10 GMT",
      "snapshot_path": "forecaster/evidence/snapshots/feed/2026/10/5dd5467e6fd3cd75c35cd5253f86f9b90c619d10a51badefb54900e0230ead59.xml.gz",
      "extract": {
        "feed_name": "Unit 42",
        "confirmation_channel": "vendor",
        "content_length": 24210,
        "_note": "本文は解釈せず生バイトで保存している。意味づけは正規化が行う。",
        "reconfirmed_at_utc": [
          "2026-10-28T22:31:56Z",
          "2026-10-29T00:26:52Z"
        ]
      },
      "parser_version": "channel-feed-v1"
    },
    {
      "evidence_id": "ev-20261029-66ba8",
      "source_url": "https://labs.watchtowr.com/rss/",
      "source_type": "vendor",
      "retrieved_at_utc": "2026-10-28T19:53:54Z",
      "content_sha256": "66ba887404c03d065c8b5ce26273c623c57f721973a9a7f04ff380b930c31218",
      "http_etag": null,
      "http_last_modified": null,
      "snapshot_path": "forecaster/evidence/snapshots/feed/2026/10/66ba887404c03d065c8b5ce26273c623c57f721973a9a7f04ff380b930c31218.xml.gz",
      "extract": {
        "feed_name": "watchTowr Labs",
        "confirmation_channel": "vendor",
        "content_length": 516052,
        "_note": "本文は解釈せず生バイトで保存している。意味づけは正規化が行う。",
        "reconfirmed_at_utc": [
          "2026-10-28T22:31:56Z",
          "2026-10-29T00:26:52Z"
        ]
      },
      "parser_version": "channel-feed-v1"
    },
    {
      "evidence_id": "ev-20261029-1795a",
      "source_url": "https://cloudblog.withgoogle.com/topics/threat-intelligence/rss/",
      "source_type": "vendor",
      "retrieved_at_utc": "2026-10-28T19:53:56Z",
      "content_sha256": "1795a465fad9f52e28b59e9eaef49a2a765f439638c406ccdfb70df43b8d9a33",
      "http_etag": null,
      "http_last_modified": null,
      "snapshot_path": "forecaster/evidence/snapshots/feed/2026/10/1795a465fad9f52e28b59e9eaef49a2a765f439638c406ccdfb70df43b8d9a33.xml.gz",
      "extract": {
        "feed_name": "Google Threat Intelligence (Mandiant)",
        "confirmation_channel": "vendor",
        "content_length": 1451172,
        "_note": "本文は解釈せず生バイトで保存している。意味づけは正規化が行う。",
        "reconfirmed_at_utc": [
          "2026-10-28T22:32:02Z",
          "2026-10-29T00:26:53Z"
        ]
      },
      "parser_version": "channel-feed-v1"
    },
    {
      "evidence_id": "ev-20261029-fbdd8",
      "source_url": "https://isc.sans.edu/rssfeed.xml",
      "source_type": "telemetry",
      "retrieved_at_utc": "2026-10-28T19:53:56Z",
      "content_sha256": "fbdd8c56fde6d39097abce2e8d2b968f25ae7bc677617698b29143a6ca41956b",
      "http_etag": "\"1860-65eebda927d76\"",
      "http_last_modified": "Wed, 28 Oct 2026 19:48:57 GMT",
      "snapshot_path": "forecaster/evidence/snapshots/feed/2026/10/fbdd8c56fde6d39097abce2e8d2b968f25ae7bc677617698b29143a6ca41956b.xml.gz",
      "extract": {
        "feed_name": "SANS Internet Storm Center",
        "confirmation_channel": "telemetry_provider",
        "content_length": 6240,
        "_note": "本文は解釈せず生バイトで保存している。意味づけは正規化が行う。"
      },
      "parser_version": "channel-feed-v1"
    },
    {
      "evidence_id": "ev-20261029-c34cd",
      "source_url": "https://isc.sans.edu/rssfeed.xml",
      "source_type": "telemetry",
      "retrieved_at_utc": "2026-10-28T22:32:02Z",
      "content_sha256": "c34cdf446951fd86015d2dcc990d561c85997eccc313a8b905f650b99d17e4ce",
      "http_etag": "\"1860-65eee16c803be\"",
      "http_last_modified": "Wed, 28 Oct 2026 22:28:57 GMT",
      "snapshot_path": "forecaster/evidence/snapshots/feed/2026/10/c34cdf446951fd86015d2dcc990d561c85997eccc313a8b905f650b99d17e4ce.xml.gz",
      "extract": {
        "feed_name": "SANS Internet Storm Center",
        "confirmation_channel": "telemetry_provider",
        "content_length": 6240,
        "_note": "本文は解釈せず生バイトで保存している。意味づけは正規化が行う。"
      },
      "parser_version": "channel-feed-v1"
    },
    {
      "evidence_id": "ev-20261029-b7942",
      "source_url": "https://isc.sans.edu/rssfeed.xml",
      "source_type": "telemetry",
      "retrieved_at_utc": "2026-10-29T00:26:54Z",
      "content_sha256": "b7942a674857b280012be18020bed7271ca87e93db3e46c79e3c0fb24f4a0f42",
      "http_etag": "\"1860-65eefb210b808\"",
      "http_last_modified": "Thu, 29 Oct 2026 00:23:57 GMT",
      "snapshot_path": "forecaster/evidence/snapshots/feed/2026/10/b7942a674857b280012be18020bed7271ca87e93db3e46c79e3c0fb24f4a0f42.xml.gz",
      "extract": {
        "feed_name": "SANS Internet Storm Center",
        "confirmation_channel": "telemetry_provider",
        "content_length": 6240,
        "_note": "本文は解釈せず生バイトで保存している。意味づけは正規化が行う。"
      },
      "parser_version": "channel-feed-v1"
    }
  ]
}
