{
  "_schema_version": "1.0",
  "_evidence_date": "2026-09-06",
  "_generated_at_utc": "2026-09-05T22:37:44Z",
  "_generator": "scripts/snapshot_sources.py",
  "evidence": [
    {
      "evidence_id": "ev-20260906-f92f4",
      "source_url": "https://www.cisa.gov/sites/default/files/feeds/known_exploited_vulnerabilities.json",
      "source_type": "cisa_kev",
      "published_at_utc": "2026-09-04T16:47:03.5197Z",
      "retrieved_at_utc": "2026-09-05T22:37:37Z",
      "content_sha256": "f92f4cef4bba9b8c69c1a34deeb825af3810ffb6a0447042d16df894751da2cf",
      "http_etag": "\"19e401-65aab049a75f8\"",
      "http_last_modified": "Fri, 04 Sep 2026 16:47:03 GMT",
      "snapshot_path": "forecaster/evidence/snapshots/kev/2026/09/f92f4cef4bba9b8c69c1a34deeb825af3810ffb6a0447042d16df894751da2cf.json.gz",
      "extract": {
        "catalog_version": "2026.09.04",
        "date_released": "2026-09-04T16:47:03.5197Z",
        "count": 1695,
        "max_date_added": "2026-09-04",
        "_full_catalog_note": "全件の cveID→dateAdded は snapshot_path のスナップショットに入っている。load_kev_snapshot() で読むこと（manifest へは重複保存しない）。"
      },
      "parser_version": "kev-extract-v1"
    },
    {
      "evidence_id": "ev-20260906-f6acf",
      "source_url": "https://www.jpcert.or.jp/rss/jpcert.rdf",
      "source_type": "cert",
      "retrieved_at_utc": "2026-09-05T22:37:37Z",
      "content_sha256": "f6acff7027996930c3da7a1841a4b872fcea11fb092aa1795c34c72dfa372f22",
      "http_etag": "\"35a7-65a9f9d064e40\"",
      "http_last_modified": "Fri, 04 Sep 2026 03:10:41 GMT",
      "snapshot_path": "forecaster/evidence/snapshots/feed/2026/09/f6acff7027996930c3da7a1841a4b872fcea11fb092aa1795c34c72dfa372f22.xml.gz",
      "extract": {
        "feed_name": "JPCERT/CC",
        "confirmation_channel": "cert",
        "content_length": 13735,
        "_note": "本文は解釈せず生バイトで保存している。意味づけは正規化が行う。"
      },
      "parser_version": "channel-feed-v1"
    },
    {
      "evidence_id": "ev-20260906-2308d",
      "source_url": "https://blogs.jpcert.or.jp/ja/atom.xml",
      "source_type": "cert",
      "retrieved_at_utc": "2026-09-05T22:37:38Z",
      "content_sha256": "2308d5aec51edca3c5298fd2742f96ce8348ced0609929917b34b9b6635cbfb2",
      "http_etag": null,
      "http_last_modified": null,
      "snapshot_path": "forecaster/evidence/snapshots/feed/2026/09/2308d5aec51edca3c5298fd2742f96ce8348ced0609929917b34b9b6635cbfb2.xml.gz",
      "extract": {
        "feed_name": "JPCERT/CC Eyes",
        "confirmation_channel": "cert",
        "content_length": 283466,
        "_note": "本文は解釈せず生バイトで保存している。意味づけは正規化が行う。"
      },
      "parser_version": "channel-feed-v1"
    },
    {
      "evidence_id": "ev-20260906-4930c",
      "source_url": "https://jvn.jp/rss/jvn.rdf",
      "source_type": "cert",
      "retrieved_at_utc": "2026-09-05T22:37:39Z",
      "content_sha256": "4930ca60ed1edab1d7048b9d30755e019acb0a0686f35607b3fd10fb50180524",
      "http_etag": "\"59c649b4da49781fea774b4c890ca354655bf923\"",
      "http_last_modified": "Fri, 04 Sep 2026 03:00:02 GMT",
      "snapshot_path": "forecaster/evidence/snapshots/feed/2026/09/4930ca60ed1edab1d7048b9d30755e019acb0a0686f35607b3fd10fb50180524.xml.gz",
      "extract": {
        "feed_name": "JVN",
        "confirmation_channel": "cert",
        "content_length": 16436,
        "_note": "本文は解釈せず生バイトで保存している。意味づけは正規化が行う。"
      },
      "parser_version": "channel-feed-v1"
    },
    {
      "evidence_id": "ev-20260906-ced3a",
      "source_url": "https://jvndb.jvn.jp/ja/rss/jvndb_new.rdf",
      "source_type": "cert",
      "retrieved_at_utc": "2026-09-05T22:37:42Z",
      "content_sha256": "ced3aca93113e8c61673f0c4c73604a242a290732642312781b48b8cd7152cdf",
      "http_etag": "\"1319f0-65ab7c754c380\"",
      "http_last_modified": "Sat, 05 Sep 2026 08:00:30 GMT",
      "snapshot_path": "forecaster/evidence/snapshots/feed/2026/09/ced3aca93113e8c61673f0c4c73604a242a290732642312781b48b8cd7152cdf.xml.gz",
      "extract": {
        "feed_name": "JVN iPedia 新着",
        "confirmation_channel": "cert",
        "content_length": 1251824,
        "_note": "本文は解釈せず生バイトで保存している。意味づけは正規化が行う。"
      },
      "parser_version": "channel-feed-v1"
    },
    {
      "evidence_id": "ev-20260906-e1398",
      "source_url": "https://www.ipa.go.jp/security/rss/alert.rdf",
      "source_type": "cert",
      "retrieved_at_utc": "2026-09-05T22:37:42Z",
      "content_sha256": "e1398ecc0b6c007fb2ac23cca8c167ef7e9dedfaa31e5f6a44c324d0eb5ef860",
      "http_etag": null,
      "http_last_modified": "Tue, 18 Aug 2026 07:19:45 GMT",
      "snapshot_path": "forecaster/evidence/snapshots/feed/2026/08/e1398ecc0b6c007fb2ac23cca8c167ef7e9dedfaa31e5f6a44c324d0eb5ef860.xml.gz",
      "extract": {
        "feed_name": "IPA 重要なセキュリティ情報",
        "confirmation_channel": "cert",
        "content_length": 127108,
        "_note": "本文は解釈せず生バイトで保存している。意味づけは正規化が行う。"
      },
      "parser_version": "channel-feed-v1"
    },
    {
      "evidence_id": "ev-20260906-55d72",
      "source_url": "https://unit42.paloaltonetworks.com/feed/",
      "source_type": "vendor",
      "retrieved_at_utc": "2026-09-05T22:37:43Z",
      "content_sha256": "55d7251201023febd861e60710bc0b4e36b01e49f318e314eba62d1e6b3072c0",
      "http_etag": "\"6c205c28799c7389996c6f1878a3307b-gzip\"",
      "http_last_modified": "Fri, 04 Sep 2026 11:42:23 GMT",
      "snapshot_path": "forecaster/evidence/snapshots/feed/2026/09/55d7251201023febd861e60710bc0b4e36b01e49f318e314eba62d1e6b3072c0.xml.gz",
      "extract": {
        "feed_name": "Unit 42",
        "confirmation_channel": "vendor",
        "content_length": 24839,
        "_note": "本文は解釈せず生バイトで保存している。意味づけは正規化が行う。"
      },
      "parser_version": "channel-feed-v1"
    },
    {
      "evidence_id": "ev-20260906-e46a4",
      "source_url": "https://labs.watchtowr.com/rss/",
      "source_type": "vendor",
      "retrieved_at_utc": "2026-09-05T22:37:43Z",
      "content_sha256": "e46a4f3317f53eda7c22e9628a3cfdb9198ce2168b056d8ccb021cb4d0053876",
      "http_etag": null,
      "http_last_modified": null,
      "snapshot_path": "forecaster/evidence/snapshots/feed/2026/09/e46a4f3317f53eda7c22e9628a3cfdb9198ce2168b056d8ccb021cb4d0053876.xml.gz",
      "extract": {
        "feed_name": "watchTowr Labs",
        "confirmation_channel": "vendor",
        "content_length": 586472,
        "_note": "本文は解釈せず生バイトで保存している。意味づけは正規化が行う。"
      },
      "parser_version": "channel-feed-v1"
    },
    {
      "evidence_id": "ev-20260906-2048f",
      "source_url": "https://cloudblog.withgoogle.com/topics/threat-intelligence/rss/",
      "source_type": "vendor",
      "retrieved_at_utc": "2026-09-05T22:37:44Z",
      "content_sha256": "2048f335e7973e75681b742b661a579e407f7affb01c161ca3d83ba1dc22d755",
      "http_etag": null,
      "http_last_modified": null,
      "snapshot_path": "forecaster/evidence/snapshots/feed/2026/09/2048f335e7973e75681b742b661a579e407f7affb01c161ca3d83ba1dc22d755.xml.gz",
      "extract": {
        "feed_name": "Google Threat Intelligence (Mandiant)",
        "confirmation_channel": "vendor",
        "content_length": 1226497,
        "_note": "本文は解釈せず生バイトで保存している。意味づけは正規化が行う。"
      },
      "parser_version": "channel-feed-v1"
    },
    {
      "evidence_id": "ev-20260906-3381a",
      "source_url": "https://isc.sans.edu/rssfeed.xml",
      "source_type": "telemetry",
      "retrieved_at_utc": "2026-09-05T22:37:44Z",
      "content_sha256": "3381a29698ad9abf2ffafad6205b3e8a81a43fa0614212c20d682078c5532b86",
      "http_etag": "\"1841-65ac3fb3e3df2\"",
      "http_last_modified": "Sat, 05 Sep 2026 22:34:00 GMT",
      "snapshot_path": "forecaster/evidence/snapshots/feed/2026/09/3381a29698ad9abf2ffafad6205b3e8a81a43fa0614212c20d682078c5532b86.xml.gz",
      "extract": {
        "feed_name": "SANS Internet Storm Center",
        "confirmation_channel": "telemetry_provider",
        "content_length": 6209,
        "_note": "本文は解釈せず生バイトで保存している。意味づけは正規化が行う。"
      },
      "parser_version": "channel-feed-v1"
    }
  ]
}
