{
  "_schema_version": "1.0",
  "_evidence_date": "2026-09-15",
  "_generated_at_utc": "2026-09-14T23:49:20Z",
  "_generator": "scripts/snapshot_sources.py",
  "evidence": [
    {
      "evidence_id": "ev-20260915-9630f",
      "source_url": "https://www.cisa.gov/sites/default/files/feeds/known_exploited_vulnerabilities.json",
      "source_type": "cisa_kev",
      "published_at_utc": "2026-09-14T19:00:02.426Z",
      "retrieved_at_utc": "2026-09-14T23:49:11Z",
      "content_sha256": "9630fea2f5dbcda3444115d95688e4491134ccc674243f0d9e8a0253e2e6fbfe",
      "http_etag": "\"1a49eb-65b760a9b62c0\"",
      "http_last_modified": "Mon, 14 Sep 2026 19:00:02 GMT",
      "snapshot_path": "forecaster/evidence/snapshots/kev/2026/09/9630fea2f5dbcda3444115d95688e4491134ccc674243f0d9e8a0253e2e6fbfe.json.gz",
      "extract": {
        "catalog_version": "2026.09.14",
        "date_released": "2026-09-14T19:00:02.426Z",
        "count": 1710,
        "max_date_added": "2026-09-14",
        "_full_catalog_note": "全件の cveID→dateAdded は snapshot_path のスナップショットに入っている。load_kev_snapshot() で読むこと（manifest へは重複保存しない）。"
      },
      "parser_version": "kev-extract-v1"
    },
    {
      "evidence_id": "ev-20260915-ade0a",
      "source_url": "https://www.jpcert.or.jp/rss/jpcert.rdf",
      "source_type": "cert",
      "retrieved_at_utc": "2026-09-14T23:49:12Z",
      "content_sha256": "ade0af3216bf38c8c2d258012d483639af405df158646e8cf663ec0d18e4fb21",
      "http_etag": "\"3451-65b6aa18876c0\"",
      "http_last_modified": "Mon, 14 Sep 2026 05:23:15 GMT",
      "snapshot_path": "forecaster/evidence/snapshots/feed/2026/09/ade0af3216bf38c8c2d258012d483639af405df158646e8cf663ec0d18e4fb21.xml.gz",
      "extract": {
        "feed_name": "JPCERT/CC",
        "confirmation_channel": "cert",
        "content_length": 13393,
        "_note": "本文は解釈せず生バイトで保存している。意味づけは正規化が行う。"
      },
      "parser_version": "channel-feed-v1"
    },
    {
      "evidence_id": "ev-20260915-2308d",
      "source_url": "https://blogs.jpcert.or.jp/ja/atom.xml",
      "source_type": "cert",
      "retrieved_at_utc": "2026-09-14T23:49:13Z",
      "content_sha256": "2308d5aec51edca3c5298fd2742f96ce8348ced0609929917b34b9b6635cbfb2",
      "http_etag": null,
      "http_last_modified": null,
      "snapshot_path": "forecaster/evidence/snapshots/feed/2026/09/2308d5aec51edca3c5298fd2742f96ce8348ced0609929917b34b9b6635cbfb2.xml.gz",
      "extract": {
        "feed_name": "JPCERT/CC Eyes",
        "confirmation_channel": "cert",
        "content_length": 283466,
        "_note": "本文は解釈せず生バイトで保存している。意味づけは正規化が行う。"
      },
      "parser_version": "channel-feed-v1"
    },
    {
      "evidence_id": "ev-20260915-22d93",
      "source_url": "https://jvn.jp/rss/jvn.rdf",
      "source_type": "cert",
      "retrieved_at_utc": "2026-09-14T23:49:14Z",
      "content_sha256": "22d93540fecdb521ccd2f75754b019ce6a0678d501a16e2d5b1ff6d955f0bb08",
      "http_etag": "\"1408c82b6e6e9726d3903d57ba969de2617ee8bd\"",
      "http_last_modified": "Mon, 14 Sep 2026 09:00:09 GMT",
      "snapshot_path": "forecaster/evidence/snapshots/feed/2026/09/22d93540fecdb521ccd2f75754b019ce6a0678d501a16e2d5b1ff6d955f0bb08.xml.gz",
      "extract": {
        "feed_name": "JVN",
        "confirmation_channel": "cert",
        "content_length": 15933,
        "_note": "本文は解釈せず生バイトで保存している。意味づけは正規化が行う。"
      },
      "parser_version": "channel-feed-v1"
    },
    {
      "evidence_id": "ev-20260915-2ed1d",
      "source_url": "https://jvndb.jvn.jp/ja/rss/jvndb_new.rdf",
      "source_type": "cert",
      "retrieved_at_utc": "2026-09-14T23:49:17Z",
      "content_sha256": "2ed1d80e6dd13fd10a18b5635d269e5cc0d6610e009eb44044804a041b3642c3",
      "http_etag": "\"101e8b-65b6cd3f665c0\"",
      "http_last_modified": "Mon, 14 Sep 2026 08:00:31 GMT",
      "snapshot_path": "forecaster/evidence/snapshots/feed/2026/09/2ed1d80e6dd13fd10a18b5635d269e5cc0d6610e009eb44044804a041b3642c3.xml.gz",
      "extract": {
        "feed_name": "JVN iPedia 新着",
        "confirmation_channel": "cert",
        "content_length": 1056395,
        "_note": "本文は解釈せず生バイトで保存している。意味づけは正規化が行う。"
      },
      "parser_version": "channel-feed-v1"
    },
    {
      "evidence_id": "ev-20260915-4b4d4",
      "source_url": "https://www.ipa.go.jp/security/rss/alert.rdf",
      "source_type": "cert",
      "retrieved_at_utc": "2026-09-14T23:49:18Z",
      "content_sha256": "4b4d420be955358b15f801c9a45930764a15d0290313504d2471450b4d3c82ed",
      "http_etag": null,
      "http_last_modified": "Wed, 09 Sep 2026 03:02:53 GMT",
      "snapshot_path": "forecaster/evidence/snapshots/feed/2026/09/4b4d420be955358b15f801c9a45930764a15d0290313504d2471450b4d3c82ed.xml.gz",
      "extract": {
        "feed_name": "IPA 重要なセキュリティ情報",
        "confirmation_channel": "cert",
        "content_length": 128088,
        "_note": "本文は解釈せず生バイトで保存している。意味づけは正規化が行う。"
      },
      "parser_version": "channel-feed-v1"
    },
    {
      "evidence_id": "ev-20260915-ff5a9",
      "source_url": "https://unit42.paloaltonetworks.com/feed/",
      "source_type": "vendor",
      "retrieved_at_utc": "2026-09-14T23:49:18Z",
      "content_sha256": "ff5a99fc5cf4f6b0071be2ad0e6bdeac52142e6f569aeec82c2dd103a8c3d7f9",
      "http_etag": "\"1571e2ad3e8ee960ebf003845ade508c-gzip\"",
      "http_last_modified": "Mon, 14 Sep 2026 10:00:01 GMT",
      "snapshot_path": "forecaster/evidence/snapshots/feed/2026/09/ff5a99fc5cf4f6b0071be2ad0e6bdeac52142e6f569aeec82c2dd103a8c3d7f9.xml.gz",
      "extract": {
        "feed_name": "Unit 42",
        "confirmation_channel": "vendor",
        "content_length": 24815,
        "_note": "本文は解釈せず生バイトで保存している。意味づけは正規化が行う。"
      },
      "parser_version": "channel-feed-v1"
    },
    {
      "evidence_id": "ev-20260915-e9bf2",
      "source_url": "https://labs.watchtowr.com/rss/",
      "source_type": "vendor",
      "retrieved_at_utc": "2026-09-14T23:49:18Z",
      "content_sha256": "e9bf29c17636740e4d8ed2d7d7791c409fd7b0873576fa81f661095c768c976c",
      "http_etag": null,
      "http_last_modified": null,
      "snapshot_path": "forecaster/evidence/snapshots/feed/2026/09/e9bf29c17636740e4d8ed2d7d7791c409fd7b0873576fa81f661095c768c976c.xml.gz",
      "extract": {
        "feed_name": "watchTowr Labs",
        "confirmation_channel": "vendor",
        "content_length": 588077,
        "_note": "本文は解釈せず生バイトで保存している。意味づけは正規化が行う。"
      },
      "parser_version": "channel-feed-v1"
    },
    {
      "evidence_id": "ev-20260915-73be3",
      "source_url": "https://cloudblog.withgoogle.com/topics/threat-intelligence/rss/",
      "source_type": "vendor",
      "retrieved_at_utc": "2026-09-14T23:49:20Z",
      "content_sha256": "73be3c95ed2f61458675346e4e047539a15000742256fdb4bcfb0031ba2c1caf",
      "http_etag": null,
      "http_last_modified": null,
      "snapshot_path": "forecaster/evidence/snapshots/feed/2026/09/73be3c95ed2f61458675346e4e047539a15000742256fdb4bcfb0031ba2c1caf.xml.gz",
      "extract": {
        "feed_name": "Google Threat Intelligence (Mandiant)",
        "confirmation_channel": "vendor",
        "content_length": 1251760,
        "_note": "本文は解釈せず生バイトで保存している。意味づけは正規化が行う。"
      },
      "parser_version": "channel-feed-v1"
    },
    {
      "evidence_id": "ev-20260915-99aa6",
      "source_url": "https://isc.sans.edu/rssfeed.xml",
      "source_type": "telemetry",
      "retrieved_at_utc": "2026-09-14T23:49:20Z",
      "content_sha256": "99aa687c83f5a9943d91be2236608d413680c8a01a0f2d9eb29332046f422fc1",
      "http_etag": "\"1dc7-65b7a021d3401\"",
      "http_last_modified": "Mon, 14 Sep 2026 23:43:59 GMT",
      "snapshot_path": "forecaster/evidence/snapshots/feed/2026/09/99aa687c83f5a9943d91be2236608d413680c8a01a0f2d9eb29332046f422fc1.xml.gz",
      "extract": {
        "feed_name": "SANS Internet Storm Center",
        "confirmation_channel": "telemetry_provider",
        "content_length": 7623,
        "_note": "本文は解釈せず生バイトで保存している。意味づけは正規化が行う。"
      },
      "parser_version": "channel-feed-v1"
    }
  ]
}
