{
  "_schema_version": "1.0",
  "_evidence_date": "2026-10-27",
  "_generated_at_utc": "2026-10-26T22:38:08Z",
  "_generator": "scripts/snapshot_sources.py",
  "evidence": [
    {
      "evidence_id": "ev-20261027-97a6e",
      "source_url": "https://www.cisa.gov/sites/default/files/feeds/known_exploited_vulnerabilities.json",
      "source_type": "cisa_kev",
      "published_at_utc": "2026-10-23T19:30:18.9209Z",
      "retrieved_at_utc": "2026-10-26T20:10:34Z",
      "content_sha256": "97a6e54bc74c651ab3c55657191db9adec6c63b05ca54e4205327cfd97a8fb70",
      "http_etag": "\"1b92f2-65e8702af0b70\"",
      "http_last_modified": "Fri, 23 Oct 2026 19:30:18 GMT",
      "snapshot_path": "forecaster/evidence/snapshots/kev/2026/10/97a6e54bc74c651ab3c55657191db9adec6c63b05ca54e4205327cfd97a8fb70.json.gz",
      "extract": {
        "catalog_version": "2026.10.23",
        "date_released": "2026-10-23T19:30:18.9209Z",
        "count": 1756,
        "max_date_added": "2026-10-23",
        "_full_catalog_note": "全件の cveID→dateAdded は snapshot_path のスナップショットに入っている。load_kev_snapshot() で読むこと（manifest へは重複保存しない）。",
        "reconfirmed_at_utc": [
          "2026-10-26T22:38:03Z"
        ]
      },
      "parser_version": "kev-extract-v1"
    },
    {
      "evidence_id": "ev-20261027-134d7",
      "source_url": "https://www.jpcert.or.jp/rss/jpcert.rdf",
      "source_type": "cert",
      "retrieved_at_utc": "2026-10-26T20:10:34Z",
      "content_sha256": "134d78ac255cdb104ff4595e061b6e39bbbfc505ab2adb7b781df72398947d0e",
      "http_etag": "\"500e-65eb99335c800\"",
      "http_last_modified": "Mon, 26 Oct 2026 07:49:52 GMT",
      "snapshot_path": "forecaster/evidence/snapshots/feed/2026/10/134d78ac255cdb104ff4595e061b6e39bbbfc505ab2adb7b781df72398947d0e.xml.gz",
      "extract": {
        "feed_name": "JPCERT/CC",
        "confirmation_channel": "cert",
        "content_length": 20494,
        "_note": "本文は解釈せず生バイトで保存している。意味づけは正規化が行う。",
        "reconfirmed_at_utc": [
          "2026-10-26T22:38:04Z"
        ]
      },
      "parser_version": "channel-feed-v1"
    },
    {
      "evidence_id": "ev-20261027-f428f",
      "source_url": "https://blogs.jpcert.or.jp/ja/atom.xml",
      "source_type": "cert",
      "retrieved_at_utc": "2026-10-26T20:10:35Z",
      "content_sha256": "f428f775ced12d614067cec5e38b4e560448f668353bce4e8c91064cb6c55f5a",
      "http_etag": null,
      "http_last_modified": null,
      "snapshot_path": "forecaster/evidence/snapshots/feed/2026/10/f428f775ced12d614067cec5e38b4e560448f668353bce4e8c91064cb6c55f5a.xml.gz",
      "extract": {
        "feed_name": "JPCERT/CC Eyes",
        "confirmation_channel": "cert",
        "content_length": 259860,
        "_note": "本文は解釈せず生バイトで保存している。意味づけは正規化が行う。",
        "reconfirmed_at_utc": [
          "2026-10-26T22:38:04Z"
        ]
      },
      "parser_version": "channel-feed-v1"
    },
    {
      "evidence_id": "ev-20261027-f1e57",
      "source_url": "https://jvn.jp/rss/jvn.rdf",
      "source_type": "cert",
      "retrieved_at_utc": "2026-10-26T20:10:35Z",
      "content_sha256": "f1e574592950e9e46e25b860a9f927c20aa932480cb02cebdfb04d79d4b67b0f",
      "http_etag": "\"ba09aacdd2893d0423048926252a28a7570faf2c\"",
      "http_last_modified": "Mon, 26 Oct 2026 09:00:18 GMT",
      "snapshot_path": "forecaster/evidence/snapshots/feed/2026/10/f1e574592950e9e46e25b860a9f927c20aa932480cb02cebdfb04d79d4b67b0f.xml.gz",
      "extract": {
        "feed_name": "JVN",
        "confirmation_channel": "cert",
        "content_length": 16944,
        "_note": "本文は解釈せず生バイトで保存している。意味づけは正規化が行う。",
        "reconfirmed_at_utc": [
          "2026-10-26T22:38:05Z"
        ]
      },
      "parser_version": "channel-feed-v1"
    },
    {
      "evidence_id": "ev-20261027-91bbc",
      "source_url": "https://www.ipa.go.jp/security/rss/alert.rdf",
      "source_type": "cert",
      "retrieved_at_utc": "2026-10-26T20:10:36Z",
      "content_sha256": "91bbc518f24ffe99cc3b753f54fb5cdcf64cdb9570e7eb750adfaee7fc7f8a83",
      "http_etag": null,
      "http_last_modified": "Thu, 22 Oct 2026 03:52:41 GMT",
      "snapshot_path": "forecaster/evidence/snapshots/feed/2026/10/91bbc518f24ffe99cc3b753f54fb5cdcf64cdb9570e7eb750adfaee7fc7f8a83.xml.gz",
      "extract": {
        "feed_name": "IPA 重要なセキュリティ情報",
        "confirmation_channel": "cert",
        "content_length": 131634,
        "_note": "本文は解釈せず生バイトで保存している。意味づけは正規化が行う。",
        "reconfirmed_at_utc": [
          "2026-10-26T22:38:06Z"
        ]
      },
      "parser_version": "channel-feed-v1"
    },
    {
      "evidence_id": "ev-20261027-ed49c",
      "source_url": "https://unit42.paloaltonetworks.com/feed/",
      "source_type": "vendor",
      "retrieved_at_utc": "2026-10-26T20:10:36Z",
      "content_sha256": "ed49cd357196f86546021ec1a1a2f1268087b29560d41654e17faf9101e70033",
      "http_etag": "\"5215835b0b28f50a615dbef741468fc7-gzip\"",
      "http_last_modified": "Mon, 26 Oct 2026 18:34:42 GMT",
      "snapshot_path": "forecaster/evidence/snapshots/feed/2026/10/ed49cd357196f86546021ec1a1a2f1268087b29560d41654e17faf9101e70033.xml.gz",
      "extract": {
        "feed_name": "Unit 42",
        "confirmation_channel": "vendor",
        "content_length": 24518,
        "_note": "本文は解釈せず生バイトで保存している。意味づけは正規化が行う。",
        "reconfirmed_at_utc": [
          "2026-10-26T22:38:07Z"
        ]
      },
      "parser_version": "channel-feed-v1"
    },
    {
      "evidence_id": "ev-20261027-af1fa",
      "source_url": "https://labs.watchtowr.com/rss/",
      "source_type": "vendor",
      "retrieved_at_utc": "2026-10-26T20:10:36Z",
      "content_sha256": "af1fa3ce527c606953fffb264f2160e12c286141f4d5a1404c4d5e330ae1d262",
      "http_etag": null,
      "http_last_modified": null,
      "snapshot_path": "forecaster/evidence/snapshots/feed/2026/10/af1fa3ce527c606953fffb264f2160e12c286141f4d5a1404c4d5e330ae1d262.xml.gz",
      "extract": {
        "feed_name": "watchTowr Labs",
        "confirmation_channel": "vendor",
        "content_length": 516052,
        "_note": "本文は解釈せず生バイトで保存している。意味づけは正規化が行う。",
        "reconfirmed_at_utc": [
          "2026-10-26T22:38:07Z"
        ]
      },
      "parser_version": "channel-feed-v1"
    },
    {
      "evidence_id": "ev-20261027-1795a",
      "source_url": "https://cloudblog.withgoogle.com/topics/threat-intelligence/rss/",
      "source_type": "vendor",
      "retrieved_at_utc": "2026-10-26T20:10:37Z",
      "content_sha256": "1795a465fad9f52e28b59e9eaef49a2a765f439638c406ccdfb70df43b8d9a33",
      "http_etag": null,
      "http_last_modified": null,
      "snapshot_path": "forecaster/evidence/snapshots/feed/2026/10/1795a465fad9f52e28b59e9eaef49a2a765f439638c406ccdfb70df43b8d9a33.xml.gz",
      "extract": {
        "feed_name": "Google Threat Intelligence (Mandiant)",
        "confirmation_channel": "vendor",
        "content_length": 1451172,
        "_note": "本文は解釈せず生バイトで保存している。意味づけは正規化が行う。",
        "reconfirmed_at_utc": [
          "2026-10-26T22:38:08Z"
        ]
      },
      "parser_version": "channel-feed-v1"
    },
    {
      "evidence_id": "ev-20261027-3413c",
      "source_url": "https://isc.sans.edu/rssfeed.xml",
      "source_type": "telemetry",
      "retrieved_at_utc": "2026-10-26T20:10:37Z",
      "content_sha256": "3413c2526150f4e4a7358477cbe9950d696ee9069f6355b8c83e60a0b0d326b9",
      "http_etag": "\"192d-65ec3e66dbba2\"",
      "http_last_modified": "Mon, 26 Oct 2026 20:08:57 GMT",
      "snapshot_path": "forecaster/evidence/snapshots/feed/2026/10/3413c2526150f4e4a7358477cbe9950d696ee9069f6355b8c83e60a0b0d326b9.xml.gz",
      "extract": {
        "feed_name": "SANS Internet Storm Center",
        "confirmation_channel": "telemetry_provider",
        "content_length": 6445,
        "_note": "本文は解釈せず生バイトで保存している。意味づけは正規化が行う。"
      },
      "parser_version": "channel-feed-v1"
    },
    {
      "evidence_id": "ev-20261027-7c1c1",
      "source_url": "https://isc.sans.edu/rssfeed.xml",
      "source_type": "telemetry",
      "retrieved_at_utc": "2026-10-26T22:38:08Z",
      "content_sha256": "7c1c10fef28afeb649e5af9f19f2acbb6c61a45637fcb596b8ce5cc2eca748a2",
      "http_etag": "\"192d-65ec5ed00f554\"",
      "http_last_modified": "Mon, 26 Oct 2026 22:33:58 GMT",
      "snapshot_path": "forecaster/evidence/snapshots/feed/2026/10/7c1c10fef28afeb649e5af9f19f2acbb6c61a45637fcb596b8ce5cc2eca748a2.xml.gz",
      "extract": {
        "feed_name": "SANS Internet Storm Center",
        "confirmation_channel": "telemetry_provider",
        "content_length": 6445,
        "_note": "本文は解釈せず生バイトで保存している。意味づけは正規化が行う。"
      },
      "parser_version": "channel-feed-v1"
    }
  ]
}
